{
  "$schema": "http://json-schema.org/draft-07/schema#",
  "title": "MatchEvent",
  "description": "A single normalized match event. Raw provider data never crosses the simulator boundary.",
  "type": "object",
  "properties": {
    "schema_version": { "$ref": "common.schema.json#/definitions/SchemaVersion" },
    "id": {
      "description": "Stable unique event id (used for de-duplication).",
      "type": "string",
      "minLength": 1
    },
    "match_id": { "$ref": "common.schema.json#/definitions/MatchId" },
    "offset": { "$ref": "common.schema.json#/definitions/Offset" },
    "period": { "$ref": "common.schema.json#/definitions/Period" },
    "match_clock_s": { "$ref": "common.schema.json#/definitions/MatchClockSeconds" },
    "type": {
      "title": "EventType",
      "description": "What happened. For own_goal, team and player are the side that put the ball into its own net; the goal counts for the opponent. goal_disallowed cancels a goal already in the feed (e.g. after a VAR review): team is the side whose goal it was, and disallowed_goal says which and why.",
      "type": "string",
      "enum": [
        "pass",
        "carry",
        "shot",
        "ball_receipt",
        "ball_recovery",
        "interception",
        "duel",
        "dribble",
        "dribbled_past",
        "clearance",
        "block",
        "pressure",
        "foul_committed",
        "foul_won",
        "miscontrol",
        "dispossessed",
        "goalkeeper",
        "fifty_fifty",
        "offside",
        "substitution",
        "half_start",
        "half_end",
        "own_goal",
        "goal_disallowed",
        "other"
      ]
    },
    "team": { "$ref": "common.schema.json#/definitions/Team" },
    "possession_id": {
      "description": "Possession sequence number within the match.",
      "type": "integer",
      "minimum": 0
    },
    "possession_team_id": { "type": "integer" },
    "player": { "$ref": "common.schema.json#/definitions/Player" },
    "location": { "$ref": "common.schema.json#/definitions/Point" },
    "end_location": { "$ref": "common.schema.json#/definitions/Point" },
    "outcome": {
      "title": "EventOutcome",
      "description": "Success or failure for actions that have one (e.g. pass completion). Omitted otherwise.",
      "type": "string",
      "enum": ["success", "failure"]
    },
    "shot": {
      "title": "ShotDetail",
      "type": "object",
      "properties": {
        "xg": { "description": "Expected goals. Omitted when the provider has none (Sportmonks).", "type": "number", "minimum": 0, "maximum": 1 },
        "outcome": {
          "title": "ShotOutcome",
          "type": "string",
          "enum": ["goal", "saved", "blocked", "off_target", "post", "other"]
        },
        "type": {
          "title": "ShotType",
          "description": "The situation the shot came from. Omitted if the provider does not say.",
          "type": "string",
          "enum": ["open_play", "free_kick", "corner", "penalty", "kick_off"]
        }
      },
      "required": ["outcome"]
    },
    "card": {
      "title": "Card",
      "description": "A card shown to player with this event: on a foul_committed, or on other for misconduct away from a foul. second_yellow is a sending-off, like red.",
      "type": "string",
      "enum": ["yellow", "second_yellow", "red"]
    },
    "penalty_awarded": {
      "description": "On foul_committed or foul_won: the foul gave away a penalty. A provider may flag both events of the same foul.",
      "type": "boolean"
    },
    "disallowed_goal": {
      "title": "DisallowedGoal",
      "description": "On goal_disallowed: the goal it cancels.",
      "type": "object",
      "properties": {
        "event_id": {
          "description": "id of the shot or own_goal event of the goal.",
          "type": "string",
          "minLength": 1
        },
        "reason": { "$ref": "common.schema.json#/definitions/DisallowedReason" }
      },
      "required": ["event_id", "reason"]
    }
  },
  "required": [
    "schema_version",
    "id",
    "match_id",
    "offset",
    "period",
    "match_clock_s",
    "type",
    "team",
    "possession_id",
    "possession_team_id"
  ]
}
